name,category,objective,benefits,eligibility,documents,contact,website
"PM Kisan Samman Nidhi","Agriculture","Income support for farmers","₹6000 per year","All landholding farmers","Land records, Aadhaar card","1800-180-1551","https://pmkisan.gov.in"
"MGNREGA","Employment","Guaranteed employment in rural areas","Minimum wage as per state rates","Adult members of rural households","Job card, Aadhaar card","1800-345-3240","https://nrega.nic.in"
"Pradhan Mantri Awas Yojana","Housing","Affordable housing for urban and rural poor","Up to ₹2.5 lakh for EWS/LIG","Economically Weaker Section","Aadhaar card, Income certificate","1800-11-6163","https://pmaymis.gov.in"
"Atal Pension Yojana","Social Security","Pension for unorganized sector workers","₹1000-5000 per month","18-40 years age","Aadhaar card, Bank account","1800-180-1100","https://www.jansuraksha.gov.in"
"Pradhan Mantri Jan Dhan Yojana","Financial Inclusion","Banking for all","Zero balance account","All citizens","Aadhaar card, Address proof","1800-180-1111","https://pmjdy.gov.in"
 